keyword,provider,is_brand,course_id,title,position,page
Künstliche Intelligenz,IBB Institut für Berufliche Bildung AG,0,10399411452,Einführung in die Künstliche Intelligenz - KI für Führungskräfte,24,2
Künstliche Intelligenz,Bildungswerk der Hessischen Wirtschaft e. V.,0,10371383869,Einführung in die Künstliche Intelligenz - KI für Führungskräfte,25,2
Künstliche Intelligenz Weiterbildung,A-Leecon GmbH,0,10389253828,Künstliche Intelligenz Weiterbildung (KI),1,1
Künstliche Intelligenz Weiterbildung,Berger Bildungsinstitut GmbH,0,10366455666,AI Literacy Weiterbildung - Künstliche Intelligenz verstehen & anwenden,2,1
Künstliche Intelligenz Weiterbildung,neuefische GmbH,0,10313269992,Künstliche Intelligenz Weiterbildung : KI Konzepte,3,1
Künstliche Intelligenz Weiterbildung,New Horizons München - IT Computer und BusinessTraining Trainings,0,10389235900,Künstliche Intelligenz Kurs für Weiterbildung mit AI Learning Development und Foundation Praxis,4,1
Künstliche Intelligenz Weiterbildung,Spiced Academy GmbH,0,10346525419,Künstliche Intelligenz Weiterbildung: Konzepte & KI Schulung,5,1
Künstliche Intelligenz Weiterbildung,A-Leecon GmbH,0,10393789177,"Weiterbildung Künstliche Intelligenz: Sicherheitsbestände, Mengen-Pläne und Lieferplan-Pflege für Disposition-Profile",6,1
Künstliche Intelligenz Weiterbildung,WBS TRAINING SE,0,10387115629,Künstliche Intelligenz (KI) in der Bildung,7,1
Künstliche Intelligenz Weiterbildung,A-Leecon GmbH,0,10393753800,"Weiterbildung Künstliche Intelligenz: Change-Narrativ, Frage-Antwort-Hubs und Stakeholder-Botschaften für Kommunikationsprofile",8,1
Künstliche Intelligenz Weiterbildung,Webmasters Akademie Nürnberg GmbH,0,10390296374,Modulare Weiterbildung Künstliche Intelligenz - Zertifizierte:r KI-Manager:in,9,1
Künstliche Intelligenz Weiterbildung,Bildung First GmbH,0,10342970953,"Scrum Weiterbildung: Master PSM 2, PSPO 1+2 Weiterbildung, Agile Leadership, Scaled, HTML CSS Kurs und Künstliche Intelligenz",10,1
Künstliche Intelligenz Weiterbildung,OneCareer,0,10377333012,Generative Künstliche Intelligenz,11,1
Künstliche Intelligenz Weiterbildung,Code S Academy Ramona Sander,0,10313811726,Künstliche Intelligenz (KI) Certified AI-Enhanced Training & Development Specialist (CAITDS),12,1
Künstliche Intelligenz Weiterbildung,OneCareer,0,10377334750,Künstliche Intelligenz Einführung,13,1
Künstliche Intelligenz Weiterbildung,brainymotion München,0,10398524580,AI Literacy - Künstliche Intelligenz für den Job,14,1
Künstliche Intelligenz Weiterbildung,Academy NH Süd,0,10350454806,Künstliche Intelligenz Technologien für datengetriebene Künstliche Intelligenz Analysen,15,1
Künstliche Intelligenz Weiterbildung,NH Schulungscenter für IT und Business GmbH,0,10396046292,Künstliche Intelligenz - KI / AI - Essentials Bundle - Künstliche Intelligenz KI Grundlagen (3M),16,1
Künstliche Intelligenz Weiterbildung,OneCareer,0,10377325277,Chancen und Risiken der Künstlichen Intelligenz in Unternehmen,17,1
Künstliche Intelligenz Weiterbildung,New Horizons München - IT Computer und BusinessTraining Trainings,0,10373009216,Künstliche Intelligenz Technologien für datengetriebene Künstliche Intelligenz Analysen,18,1
Künstliche Intelligenz Weiterbildung,ebam Akademie für Wirtschaft und Management,0,10332452882,Künstliche Intelligenz & Business AI,19,1
Künstliche Intelligenz Weiterbildung,A-Leecon GmbH,0,10393733514,Programmieren mit Künstlicher Intelligenz und Jobcoaching,20,1
Künstliche Intelligenz Weiterbildung,mycareernow,0,10396860817,Grundlagen der Künstlichen Intelligenz und digitale Computerkenntnisse,21,2
Künstliche Intelligenz Weiterbildung,mycareernow,0,10396884277,Projektmanager für Künstliche Intelligenz und Scrum,22,2
Künstliche Intelligenz Weiterbildung,IU Akademie IU Internationale Hochschule,0,10375245143,Künstliche Intelligenz - Entwicklung,23,2
Künstliche Intelligenz Weiterbildung,A-Leecon GmbH,0,10393691244,ChatGPT Experte: Künstliche Intelligenz und Textgenerierung,24,2
Künstliche Intelligenz Weiterbildung,Do IT Digital GmbH,0,10379017294,Einführung in die Künstliche Intelligenz - KI für Führungskräfte,25,2
Marketing Automation,DCI Digital Career Institute GmbH,0,10365467224,Marketing Automation - Quereinstieg,1,1
Marketing Automation,DCI Digital Career Institute GmbH,0,10365880670,Marketing Automation - beruflicher Einstieg,2,1
Marketing Automation,Karriere Tutor GmbH,0,10391015122,KI-Tools & Automation im Marketing,3,1
Marketing Automation,GrandEdu GmbH,0,10367851438,Marketing Automation und CRM-Tools,4,1
Marketing Automation,DCI Digital Career Institute GmbH,0,10365881209,Marketing Automation Assistant - Kampagnenmanagement digital,5,1
Marketing Automation,Forward Education GmbH,0,10388711112,Marketing Automation Manager: KI-gestützte Kampagnenentwicklung,6,1
Marketing Automation,DCI Digital Career Institute GmbH,0,10362683442,Marketing Automation für Online Growth,7,1
Marketing Automation,Forward Education GmbH,0,10388712357,Marketing Automation Manager - Spezialisierung in KI-gestützten Kampagnen,8,1
Marketing Automation,DCI Digital Career Institute GmbH,0,10366198773,Content & KI-Automation Assistant - Marketing-Daten analysieren,9,1
Marketing Automation,Talentspring Academy Group,0,10385766829,Marketing Automation,10,1
Marketing Automation,ImpaQt Education Group,0,10372712554,Marketing Automation Manager - Vertiefung in Kampagnenoptimierung,11,1
Marketing Automation,Masters of Digital GmbH,0,10395138521,Automation im Marketing in der digitalen Transformation,12,1
Marketing Automation,Ironhack Germany GmbH,0,10371631703,Marketing Automation mit CRM,13,1
Marketing Automation,DCI Digital Career Institute GmbH,0,10366056022,Content & KI-Automation Assistant - E-Mail Marketing Tools,14,1
Marketing Automation,Ironhack Germany GmbH,0,10371631728,Marketing Automation E-Commerce,15,1
Marketing Automation,Forward Education GmbH,0,10388678095,Marketing Automation Manager: CRM-Automatisierung & HubSpot,16,1
Marketing Automation,Forward Education GmbH,0,10388665305,Marketing Automation Manager: KI-gestützte Kampagnen mit HubSpot,17,1
Marketing Automation,ImpaQt Education Group,0,10372712568,Marketing 4.0 für Marketing Automation Manager: Google Ads-Strategien,18,1
Marketing Automation,Ironhack Germany GmbH,0,10371631724,Marketing Automation Retargeting,19,1
Marketing Automation,Forward Education GmbH,0,10388713848,KI-gestützter Marketing Automation Manager: Kampagnenoptimierung mit Google Ads,20,1
Marketing Automation,Digethic Business School,0,10344970024,"Digital Marketing Manager, specialised in Marketing Automation",21,2
Marketing Automation,Forward Education GmbH,0,10388682259,Chatbot-Entwicklung für Marketing Automation Manager,22,2
Marketing Automation,Professionals Online Akademie für Sales und Marketing,0,10348233345,"Big Data, Automation, KI- und Metaverse-Marketing",23,2
Marketing Automation,Itera Campus,0,10395080407,Lead-Nurturing Automation,24,2
Marketing Automation,Learnix GmbH,0,10390907260,Marketing Automation Spezialist,25,2
Marketing Kampagnen,Nest Academy GmbH,0,10400350327,Online Marketing: Kampagnen und Ads,1,1
Marketing Kampagnen,GrandEdu GmbH,0,10367843548,Influencer Marketing und digitale Kampagnen,2,1
Marketing Kampagnen,IFM GmbH,0,10377005856,KI im Marketing - So bringen Sie Ihre Kampagnen aufs nächste Level,3,1
Marketing Kampagnen,OneCareer,0,10382965724,Digitales Marketing und Online Kampagnen im Performance Marketing,4,1
Marketing Kampagnen,COMCAVE.COLLEGE GmbH,0,10388325391,Prompt Engineering - Marketing Kampagnen Management mit ChatGPT,5,1
Marketing Kampagnen,Karriere Tutor GmbH,0,10393247362,Online Marketing - Funnels und Kampagnen,6,1
Marketing Kampagnen,mycareernow,0,10397007200,"Digital Marketing: E-Mail-Kampagnen, Unternehmensführung und digitale Prozesse mit KI",7,1
Marketing Kampagnen,Learning Digital Academy GmbH,0,10392044713,Social Media Kampagnen und Ads,8,1
Marketing Kampagnen,OneCareer,0,10377318206,E-Mail Marketing und Erfolgsmessung in digitalen Kampagnen,9,1
Marketing Kampagnen,Forward Education GmbH,0,10388665305,Marketing Automation Manager: KI-gestützte Kampagnen mit HubSpot,10,1
Marketing Kampagnen,OneCareer,0,10377317969,Display Kampagne und Google Suchnetzwerk im Online Marketing,11,1
Marketing Kampagnen,mycareernow,0,10396992228,Online Marketing mit Analytik und E-Mail-Kampagnen sowie Projektmanagement-Zertifizierung,12,1
Marketing Kampagnen,OneCareer,0,10397480883,Meta Ads Kampagnen für Produktlaunches,13,1
Marketing Kampagnen,OneCareer,0,10377319420,Online Kampagnen,14,1
Marketing Kampagnen,Talentspring Academy Group,0,10385799732,Multichannel-Kampagnen auf Basis von HubSpot für Marketing Manager:in,15,1
Marketing Kampagnen,Karriere Tutor GmbH,0,10393237067,Online Kampagnen,16,1
Marketing Kampagnen,academy7,0,10373010876,Analyst für Marketing inkl. Einführung in Content Kampagnen,17,1
Marketing Kampagnen,OneCareer,0,10377318066,Display Kampagne,18,1
Marketing Kampagnen,A-Leecon GmbH,0,10389250784,Marketing-Kampagnen mit KI und ITIL® 4 Foundation,19,1
Marketing Kampagnen,Masters of Digital GmbH,0,10389782610,Kampagnen mit Google und Meta,20,1
Marketing Kampagnen,Forward Education GmbH,0,10388712357,Marketing Automation Manager - Spezialisierung in KI-gestützten Kampagnen,21,2
Marketing Kampagnen,OneCareer,0,10377318830,Google Marketing und Advertising für Online Kampagnen,22,2
Marketing Kampagnen,academy7,0,10373011100,Fachanalyst für Marketing inkl. Storytelling und Influencer Kampagnen,23,2
Marketing Kampagnen,OneCareer,0,10377318491,Email Marketing und Retargeting Strategien für effiziente Kampagnen,24,2
Marketing Kampagnen,OneCareer,0,10377317295,Campaign Manager und Performance Marketing für Online Kampagnen,25,2
Marketing Manager,Talentspring Academy Group,0,10393422000,Marketing Manager:in,1,1
Marketing Manager,OneCareer,0,10377316849,Marketing Manager,2,1
Marketing Manager,Digethic Business School,0,10344970030,Digital Marketing Manager und Digital Transformation Manager,3,1
Marketing Manager,Digethic Business School,0,10344970031,Digital Marketing Manager und KI Manager,4,1
Marketing Manager,Learnix GmbH,0,99105147,Online Marketing Manager / eMarketing Manager,5,1
Marketing Manager,COMCAVE.COLLEGE GmbH,0,10388476626,Online Marketing Manager,6,1
Marketing Manager,Learning Digital Academy GmbH,0,10392543144,Scrum Marketing Manager,7,1
Marketing Manager,OneCareer,0,10377317695,Digital Marketing Manager,8,1
Marketing Manager,Wildner Akademie für Digitale Wirtschaft & Management,0,10123871695,Online Marketing Manager,9,1
Marketing Manager,alfatraining Bildungszentrum GmbH,0,10373379330,Online Marketing Manager:in,10,1
Marketing Manager,Karriere Tutor GmbH,0,99102366,Online Marketing Manager,11,1
Marketing Manager,alfatraining Bildungszentrum GmbH,0,10373632415,Influencer Marketing Manager:in,12,1
Marketing Manager,Talentspring Academy Group,0,10393424953,Digital Marketing Manager,13,1
Marketing Manager,alfatraining Bildungszentrum GmbH,0,10373379611,Content Marketing Manager:in,14,1
Marketing Manager,Berger Bildungsinstitut GmbH,0,10329061835,Digital Marketing Manager,15,1
Marketing Manager,Talentspring Academy Group,0,10393432915,SEA Manager:in,16,1
Marketing Manager,Talentspring Academy Group,0,10393422911,Online Marketing Manager,17,1
Marketing Manager,neuefische GmbH,0,10339677955,Digital Marketing Manager,18,1
Marketing Manager,Donner + Partner GmbH Sachsen,0,10362699741,Manager:in Onlinehandel,19,1
Marketing Manager,OneCareer,0,10377317072,Advertising Manager,20,1
Marketing Manager,Talentspring Academy Group,0,10393439160,Performance Marketing Manager,21,2
Marketing Manager,OneCareer,0,10377319584,Performance Marketing Manager,22,2
Marketing Manager,alfatraining Bildungszentrum GmbH,0,10373377231,SEM Manager:in,23,2
Marketing Manager,cimdata Bildungsakademie GmbH,0,10355432563,SEA Manager:in,24,2
Marketing Manager,OneCareer,0,10377319693,SEA Manager,25,2
Marketing mit AI,neuefische GmbH,0,10365904342,Application Manager im Marketing (mit AI),1,1
Marketing mit AI,neuefische GmbH,0,10365904424,SEO SEA Strategie in der Marketing (mit AI),2,1
Marketing mit AI,Talentspring Academy Group,0,10386259959,Notion AI,3,1
Marketing mit AI,New Horizons Nord / West,0,10396075868,Künstliche Intelligenz - KI / AI - AI + Marketing,4,1
Marketing mit AI,NH Schulungscenter für IT und Business GmbH,0,10396047303,Künstliche Intelligenz - KI / AI - AI + Marketing,5,1
Marketing mit AI,Talentspring Academy Group,0,10385654912,Jasper AI,6,1
Marketing mit AI,neuefische GmbH,0,10365895133,Marketing mit generativer AI,7,1
Marketing mit AI,neuefische GmbH,0,10365893257,AI-Powered Marketing,8,1
Marketing mit AI,New Horizons Hamburg / Bremen,0,10397104244,Künstliche Intelligenz - KI / AI - AI + Marketing,9,1
Marketing mit AI,New Horizons Hannover/Leipzig,0,10384518480,Künstliche Intelligenz - KI / AI - AI + Marketing,10,1
Marketing mit AI,neuefische GmbH,0,10365904261,Marketing Automatisierung mit AI,11,1
Marketing mit AI,New Horizons Köln - NH Schulungscenter für IT und Business GmbH,0,10395929715,Künstliche Intelligenz - KI / AI - AI + Marketing,12,1
Marketing mit AI,Bold Academy GmbH,0,10400783412,AI Marketing und Sales,13,1
Marketing mit AI,ImpaQt Education Group,0,10382751481,Marketing Automatisierung mit AI,14,1
Marketing mit AI,New Horizons München - IT Computer und BusinessTraining Trainings,0,10389235704,AI Marketing Kurs mit AI Marketing und Context Engineering Praxis,15,1
Marketing mit AI,A-Leecon GmbH,0,10389257220,Marketing mit KI/AI,16,1
Marketing mit AI,neuefische GmbH,0,10365904548,Marketingkampagnen design mit AI,17,1
Marketing mit AI,Nest Academy GmbH,0,10398371977,Generative ai und Marketing,18,1
Marketing mit AI,neuefische GmbH,0,10365893507,Online Marketing Masterclass mit AI,19,1
Marketing mit AI,neuefische GmbH,0,10365893191,Performance Marketing mit AI Weiterbildung,20,1
Marketing mit AI,Karriere Tutor GmbH,0,10391016163,AI-Driven Marketing Manager,21,2
Marketing mit AI,neuefische GmbH,0,10365903537,Weiterbildung im Suchmaschinenmarketing mit AI,22,2
Marketing mit AI,neuefische GmbH,0,10365893442,AI in der Performance Marketing Management,23,2
Marketing mit AI,neuefische GmbH,0,10365903515,Weiterbildung im Digital Marketing mit AI,24,2
Marketing mit AI,A-Leecon GmbH,0,10390208812,"Project Management, Social Media Marketing with AI, and Information Security Auditing",25,2
Marketing Weiterbildung,neuefische GmbH,0,10365903537,Weiterbildung im Suchmaschinenmarketing mit AI,1,1
Marketing Weiterbildung,neuefische GmbH,0,10365893191,Performance Marketing mit AI Weiterbildung,2,1
Marketing Weiterbildung,neuefische GmbH,0,10365903515,Weiterbildung im Digital Marketing mit AI,3,1
Marketing Weiterbildung,WBK Akademie GmbH,0,10390063975,Content Marketing Manager Weiterbildung,4,1
Marketing Weiterbildung,OMR Education GmbH,0,10377897510,Modulare Weiterbildung: Performance Marketing,5,1
Marketing Weiterbildung,WBK Akademie GmbH,0,10390063259,Online Marketing Manager Weiterbildung,6,1
Marketing Weiterbildung,ecomex GmbH & Co. KG,1,10396774124,Weiterbildung im E-Commerce mit KI,7,1
Marketing Weiterbildung,Nest Academy GmbH,0,10400350362,Weiterbildung im Performance Marketing: Google Ads und Conversion,8,1
Marketing Weiterbildung,Spiced Academy GmbH,0,10345494788,Weiterbildung im Bereich KI-gestütztes Performance-Marketing,9,1
Marketing Weiterbildung,Spiced Academy GmbH,0,10346528026,Suchmaschinenmarketing: Weiterbildung mit AI,10,1
Marketing Weiterbildung,Coaching- & Weiterbildungswunder GmbH,0,10375683348,"Weiterbildung für Webentwicklung, E-Commerce und Online Marketing mit KI-Kompetenzen",11,1
Marketing Weiterbildung,Talentivo GmbH,0,10379192383,Digital Marketing Weiterbildung,12,1
Marketing Weiterbildung,Morphos GmbH,0,10344969510,Weiterbildung Online Marketing und Social Media Manager*in,13,1
Marketing Weiterbildung,OMR Education GmbH,0,10377897520,Modulare Weiterbildung: Instagram Marketing,14,1
Marketing Weiterbildung,Webmasters Akademie Nürnberg GmbH,0,10120745416,"Experte für Web Content Management, Blogs und E-Mail-Marketing: Weiterbildung zum Content Marketing Manager",15,1
Marketing Weiterbildung,mycareernow,0,10397002942,"Weiterbildung Digital Marketing: SEO, SEA & Social Media mit KI-gestützter Videoproduktion",16,1
Marketing Weiterbildung,OMR Education GmbH,0,10377897529,Modulare Weiterbildung: Facebook & Instagram Advertising,17,1
Marketing Weiterbildung,A-Leecon GmbH,0,10393744220,"Weiterbildung Datengetriebenes Marketing: Reisekalkulationen, Statusberichte und Onboarding-Pakete für Teamassistenzen",18,1
Marketing Weiterbildung,Learnix GmbH,0,10398774972,Praxisnahe Weiterbildung für den digitalen Berufsalltag,19,1
Marketing Weiterbildung,OMR Education GmbH,0,10377897526,Modulare Weiterbildung: Digital Marketing Analytics,20,1
Marketing Weiterbildung,Talentspring Academy Group,0,10373819576,IT-Vertrieb Neukunden gewinnen Weiterbildung - Outreach Marketing KI,21,2
Marketing Weiterbildung,Deutsche Hochschule für Angewandte Wissenschaften - German University of Applied Sciences,0,20101000136924,Weiterbildung Online Marketing,22,2
Marketing Weiterbildung,OMR Education GmbH,0,10377897482,Modulare Weiterbildung: Digital Marketing Strategy,23,2
Marketing Weiterbildung,A-Leecon GmbH,0,10393697392,"Weiterbildung B2B-Marketing: Tarif-Pflege, Reisekosten-Workflows und Monatslohnläufe für Lohn- und Gehaltsbuchhaltung",24,2
Marketing Weiterbildung,Mentify Learn GmbH,0,10368019619,Weiterbildung im E-Commerce mit KI,25,2
Marketingkampagnen mit AI,Spiced Academy GmbH,0,10345495509,AI-Tools für Marketingkampagnen Design,1,1
Marketingkampagnen mit AI,neuefische GmbH,0,10365904548,Marketingkampagnen design mit AI,2,1
Marketingkampagnen mit AI,A-Leecon GmbH,0,10393652526,"KI im Projektmanagement, EU AI Act Compliance und datengesteuerte Marketingkampagnen",3,1
Marketingkampagnen mit AI,A-Leecon GmbH,0,10393721611,"KI im Projektmanagement: Grundlagen, Ethik, Recht und Marketingkampagnen",4,1
Marketingkampagnen mit AI,ImpaQt Education Group,0,10382751481,Marketing Automatisierung mit AI,5,1
Marketingkampagnen mit AI,Masters of Digital GmbH,0,10389780939,AI Performance Marketing & Project Management,6,1
Marketingkampagnen mit AI,neuefische GmbH,0,10365895466,Marketing- und Vertriebsoptimierung mit AI LLMs,7,1
Marketingkampagnen mit AI,Academy NH Süd,0,10350432532,AI - Artificial Intelligence Practitioner,8,1
Marketingkampagnen mit AI,A-Leecon GmbH,0,10393741024,EU AI Act Zertifikat und Marketing: Videoerstellung mit KI,9,1
Marketingkampagnen mit AI,New Horizons München - IT Computer und BusinessTraining Trainings,0,10357136606,AI - Artificial Intelligence Practitioner,10,1
Marketingkampagnen mit AI,A-Leecon GmbH,0,10389257185,KI-gestützte Social-Media-Strategien und EU AI Act Compliance,11,1
Marketingkampagnen mit AI,Academy NH Süd,0,10350421051,Artificial Intelligence (AI) Development mit Python 2.0,12,1
Marketingkampagnen mit AI,New Horizons München - IT Computer und Business Trainings,0,10365497738,Artificial Intelligence (AI) Development mit Python 2.0,13,1
Marketingkampagnen mit AI,A-Leecon GmbH,0,10393697380,KI im Marketing: Rechtliche Grundlagen des EU AI Act und KI-gestützte Content-Erstellung,14,1
Marketingkampagnen mit AI,New Horizons München - IT Computer und BusinessTraining Trainings,0,10357138730,Künstlicher Intelligenz (KI): Artificial Intelligence (AI) Kurse,15,1
Marketingkampagnen mit AI,neuefische GmbH,0,10365904572,Digital Marketing Automatisierung mit KI,16,1
Marketingkampagnen mit AI,New Horizons München - IT Computer und BusinessTraining Trainings,0,10357132328,Datenanalyse + Artificial Intelligence (AI): Data Analyst Kurs für Dataanalysten mit Künstlicher Intelligenz (KI),17,1
Marketingkampagnen mit AI,Spiced Academy GmbH,0,10345495515,Automatisierung mit KI für Digital Marketing Workflows,18,1
Marketingkampagnen mit AI,WBS TRAINING SE,0,10388938367,Konzeption und Entwicklung von KI-Projekten,19,1
Marketingkampagnen mit AI,Spiced Academy GmbH,0,10345494867,Google Analytics: Marketingdaten verstehen und messen,20,1
Marketingkampagnen mit AI,Spiced Academy GmbH,0,10346528120,Digital Marketing Methoden und datengetriebene Konzepte,21,2
Marketingkampagnen mit AI,neuefische GmbH,0,10365897729,Google Analytics: Analyse digitaler Marketingdaten,22,2
Marketingkampagnen mit AI,A-Leecon GmbH,0,10389256825,KI-gestützte Kampagnenerstellung und Marketingstrategien,23,2
Marketingkampagnen mit AI,Code S Academy Ramona Sander,0,10298016885,Künstliche Intelligenz (KI) E-Commerce AI Innovator (ECAI),24,2
Marketingkampagnen mit AI,Bildungswerk der Hessischen Wirtschaft e. V.,0,10371382028,KI-Masterclass Prompt-Designing im Marketing,25,2
Marketingstrategie mit KI,Nest Academy GmbH,0,10398372190,KI Marketing: Marketingstrategie,1,1
Marketingstrategie mit KI,A-Leecon GmbH,0,10393649790,Marketingstrategie und Datenanalyse mit KI,2,1
Marketingstrategie mit KI,Masters of Digital GmbH,0,10389784772,Marketingstrategie mit KI,3,1
Marketingstrategie mit KI,A-Leecon GmbH,0,10387475248,Marketingstrategie mit KI,4,1
Marketingstrategie mit KI,A-Leecon GmbH,0,10393783653,Marketingstrategie und Kampagnenerstellung mit KI,5,1
Marketingstrategie mit KI,A-Leecon GmbH,0,10393650205,Marketingstrategie und Videoerstellung mit KI,6,1
Marketingstrategie mit KI,neuefische GmbH,0,10339680512,KI Marketing: Marketingstrategie,7,1
Marketingstrategie mit KI,A-Leecon GmbH,0,10393742074,Marketingstrategie und Texterstellung mit KI,8,1
Marketingstrategie mit KI,A-Leecon GmbH,0,10393664193,Marketingstrategie und Contenterstellung mit KI,9,1
Marketingstrategie mit KI,cimdata Bildungsakademie GmbH,0,10355432149,Digitales Marketing und KI: erfolgreiche Marketingstrategien entwickeln,10,1
Marketingstrategie mit KI,A-Leecon GmbH,0,10393653193,KI-Marketingstrategie und Prompt Engineering,11,1
Marketingstrategie mit KI,A-Leecon GmbH,0,10389252483,DevOps-Praktiken und KI-gestützte Marketingstrategien,12,1
Marketingstrategie mit KI,A-Leecon GmbH,0,10393777018,"KI für Projektmanager, Marketingstrategie und Design Thinking",13,1
Marketingstrategie mit KI,A-Leecon GmbH,0,10389250825,KI-gestützte Marketingstrategien und Informationssicherheits-Audits,14,1
Marketingstrategie mit KI,A-Leecon GmbH,0,10389255096,KI-gestützte Marketingstrategien und KI-Governance,15,1
Marketingstrategie mit KI,A-Leecon GmbH,0,10389248782,Schnelle IT-Services und KI-gestützte Marketingstrategien,16,1
Marketingstrategie mit KI,A-Leecon GmbH,0,10393738875,"KI-Anwendungen in Projektmanagement, agilem Management und Marketingstrategie",17,1
Marketingstrategie mit KI,A-Leecon GmbH,0,10393747902,"KI-gestütztes Projektmanagement: Kommunikation, Konfliktmanagement und Marketingstrategie",18,1
Marketingstrategie mit KI,DIBA Bildungsakademie GmbH,0,10397922480,Digital Marketing Manager mit KI-gestützten Marketingstrategien,19,1
Marketingstrategie mit KI,A-Leecon GmbH,0,10389253739,Agile Projektgestaltung und KI-gestützte Marketingstrategien,20,1
Marketingstrategie mit KI,A-Leecon GmbH,0,10389256334,KI-gestützte Serviceerbringung und Marketingstrategien,21,2
Marketingstrategie mit KI,GrandEdu GmbH,0,10379357565,"KI und Automatisierung, Social Media und Marketingstrategie für Social Media Manager",22,2
Marketingstrategie mit KI,mycareernow,0,10396979824,Social Media Marketing und digitale Marketingstrategien mit KI und SEO,23,2
Marketingstrategie mit KI,A-Leecon GmbH,0,10389256825,KI-gestützte Kampagnenerstellung und Marketingstrategien,24,2
Marketingstrategie mit KI,A-Leecon GmbH,0,10393782421,"KI im Projektmanagement, datenbasierte Marketingstrategie und ISO 27001 Lead Implementer",25,2
Marktanalyse mit KI,Masters of Digital GmbH,0,10389786602,Marktanalyse mit KI,1,1
Marktanalyse mit KI,A-Leecon GmbH,0,10387472405,Marktanalyse KI,2,1
Marktanalyse mit KI,A-Leecon GmbH,0,10393659194,"KI im Management: Projektsteuerung, Marktanalyse und strategischer KI-Einsatz",3,1
Marktanalyse mit KI,A-Leecon GmbH,0,10393679505,KI Officer und Marktanalyse,4,1
Marktanalyse mit KI,A-Leecon GmbH,0,10393667217,KI in Marktanalyse und agiler Projektleitung,5,1
Marktanalyse mit KI,A-Leecon GmbH,0,10393678854,"KI für Projektmanagement, Marktanalyse und Contenterstellung",6,1
Marktanalyse mit KI,A-Leecon GmbH,0,10389246940,KI-gestützte Texterstellung und Marktanalyse im Marketing,7,1
Marktanalyse mit KI,A-Leecon GmbH,0,10393777844,KI-Manager und Marktanalyse mit Künstlicher Intelligenz,8,1
Marktanalyse mit KI,A-Leecon GmbH,0,10393655508,"KI-Anwendungen im Projektmanagement, KI-gestützte Marktanalyse und agile Projektmanagement-Software",9,1
Marktanalyse mit KI,A-Leecon GmbH,0,10393728215,"KI-gestütztes Projektmanagement, Marktanalyse und agile Führung",10,1
Marktanalyse mit KI,A-Leecon GmbH,0,10393686512,Marketing: Marktanalyse mit KI und Projektmanagement-Coach,11,1
Marktanalyse mit KI,Karriere Tutor GmbH,0,10396151575,KI-gestützte Marktanalyse für Marketingstratege:in,12,1
Marktanalyse mit KI,A-Leecon GmbH,0,10389246134,DevOps-Prozessoptimierung und KI-gestützte Marktanalyse,13,1
Marktanalyse mit KI,ImpaQt Education Group,0,10382752395,Eu AI Act und Marktanalyse mit KI,14,1
Marktanalyse mit KI,A-Leecon GmbH,0,10393754471,"KI-gestützte Arbeitsabläufe: Projektmanagement, Marktanalyse und Workflow-Automatisierung",15,1
Marktanalyse mit KI,A-Leecon GmbH,0,10393740036,"KI-Anwendungen in Projektmanagement, Marketing und Marktanalyse mit ChatGPT und Large Language Models",16,1
Marktanalyse mit KI,A-Leecon GmbH,0,10393760234,"KI-gestützte Projektsteuerung, Marktanalyse und ITIL 4 Drive Stakeholder Value",17,1
Marktanalyse mit KI,Digitale Leute School,0,99103211,Marktanalyse im Produktmanagement,18,1
Marktanalyse mit KI,Talentspring Academy Group,0,10393425794,Marketing & KI,19,1
Marktanalyse mit KI,A-Leecon GmbH,0,10393760905,KI-Anwendungen in Projektmanagement und Marktanalyse sowie digitale IT-Strategie mit ITIL 4 Strategic Leader,20,1
