keyword,provider,is_brand,course_id,title,position,page
Projektmanagement mit AI,New Horizons München - IT Computer und BusinessTraining Trainings,0,10389199678,SCRUM Master Kurs mit KI (IT Projektmanagement mit AI+ Project Manager),6,1
Projektmanagement mit AI,ImpaQt Education Group,0,10380884971,AI Projectlead,7,1
Projektmanagement mit AI,neuefische GmbH,0,10310078248,"UX/UI-Design mit AI, UX-Projektmanagement und Zusammenarbeit",8,1
Projektmanagement mit AI,IU Akademie IU Internationale Hochschule,0,10314068656,AI Project Management,9,1
Projektmanagement mit AI,neuefische GmbH,0,10365901754,AI im Projektmanagement für Quereinsteiger,10,1
Projektmanagement mit AI,neuefische GmbH,0,10313265590,"NLP, ML und AI im Projektmanagement",11,1
Projektmanagement mit AI,neuefische GmbH,0,10365896709,AI für das IT-Projektmanagement,12,1
Projektmanagement mit AI,Smart Future Campus GmbH,0,10388606577,Data Science & AI mit Projektmanagement,13,1
Projektmanagement mit AI,New Horizons Hamburg / Bremen,0,10397073628,Künstliche Intelligenz - KI / AI - AI + Project Manager,14,1
Projektmanagement mit AI,New Horizons Hannover/Leipzig,0,10384500601,Künstliche Intelligenz - KI / AI - AI + Project Manager,15,1
Projektmanagement mit AI,NH Schulungscenter für IT und Business GmbH,0,10396037335,Künstliche Intelligenz - KI / AI - AI + Project Manager,16,1
Projektmanagement mit AI,New Horizons Köln - NH Schulungscenter für IT und Business GmbH,0,10395922214,Künstliche Intelligenz - KI / AI - AI + Project Manager,17,1
Projektmanagement mit AI,New Horizons Nord / West,0,10396070791,Künstliche Intelligenz - KI / AI - AI + Project Manager,18,1
Projektmanagement mit AI,mycareernow,0,10396941134,Chief AI Officer,19,1
Projektmanagement mit AI,A-Leecon GmbH,0,10390117160,AI Officer Training,20,1
Projektmanagement mit AI,IU Akademie IU Internationale Hochschule,0,10308943908,AI Project Management Masterclass,21,2
Projektmanagement mit AI,Ironhack Germany GmbH,0,10366714259,AI Consulting & Integration,22,2
Projektmanagement mit AI,COMCAVE.COLLEGE GmbH,0,10388394876,KI-Engineering: AI-gestütztes Projektmanagement,23,2
Projektmanagement mit AI,neuefische GmbH,0,10327093119,AI Project Management,24,2
Projektmanagement mit AI,COMCAVE.COLLEGE GmbH,0,10388321892,KI Manager - AI Projektmanagement im Marketing,25,2
Projektmanager Marketing,Learning Digital Academy GmbH,0,10392557638,Scrum Projektmanager Marketing,1,1
Projektmanager Marketing,Learning Digital Academy GmbH,0,10392554641,Scrum Projektmanager Marketing mit Leadership,2,1
Projektmanager Marketing,Learning Digital Academy GmbH,0,10392560672,Scrum Projektmanager SEO Marketing,3,1
Projektmanager Marketing,Learning Digital Academy GmbH,0,10392016947,Scrum Projektmanager Marketing mit Design Thinking,4,1
Projektmanager Marketing,OneCareer,0,10382966433,Scrum Projektmanager SEO Marketing,5,1
Projektmanager Marketing,Learning Digital Academy GmbH,0,10392561326,Scrum Projektmanager Data Driven Marketing,6,1
Projektmanager Marketing,OneCareer,0,10382966405,Scrum Projektmanager Marketing,7,1
Projektmanager Marketing,OneCareer,0,10377339377,Scrum Projektmanager Marketing mit Leadership,8,1
Projektmanager Marketing,OneCareer,0,10377321346,Social Media Strategien für Projektmanager mit Fokus auf Marketing,9,1
Projektmanager Marketing,Talentspring Academy Group,0,10386302013,KI-Projektmanager:in - Dokumentations-KI,10,1
Projektmanager Marketing,COMCAVE.COLLEGE GmbH,0,10388367123,Projektmanager für Online Marketing,11,1
Projektmanager Marketing,Alphadi Akademie,0,10135524707,"Projektmanager/in (PMI) inkl. Marketing, Qualitätssicherung und Q-Audit",12,1
Projektmanager Marketing,Alphadi Akademie,0,10135524737,"Projektmanager/in (PMI) inkl. Q-Management, Marketing und Qualitätssicherung",13,1
Projektmanager Marketing,mycareernow,0,10396881478,Projektmanager im Organischen Marketing mit Scrum PSM I,14,1
Projektmanager Marketing,ptm Akademie GmbH Private,0,10126368927,Digital Projektmanager/-in für Online-Marketing und Social Media,15,1
Projektmanager Marketing,Alphadi Akademie,0,10135524706,"Projektmanager/in (PMI) inkl. Marketing, Lean und Qualitätssicherung",16,1
Projektmanager Marketing,Alphadi Akademie,0,10135524719,"Projektmanager/in (PMI) inkl. Prozessanalyse, Marketing und Lean Management",17,1
Projektmanager Marketing,mycareernow,0,10396888207,Projektmanager im Performance Marketing mit Scrum PSM I,18,1
Projektmanager Marketing,Alphadi Akademie,0,10135552223,"Projektmanager/in (PMI) inkl. Q-Management, Marketing und Sales Management",19,1
Projektmanager Marketing,Talentspring Academy Group,0,10386328560,Vergleich und Evaluierung für KI-Projektmanager:in,20,1
Projektmanager Marketing,Alphadi Akademie,0,10135524736,"Projektmanager/in (PMI) inkl. Q-Management, Marketing und Lean Management",21,2
Projektmanager Marketing,mycareernow,0,10397012558,"Projektmanager und Digital Marketing Manager mit SEO, SEA, Social Media und KI-Tools",22,2
Projektmanager Marketing,Alphadi Akademie,0,10135524727,"Projektmanager/in (PMI) inkl. Prozessanalyse, Q-Management und Marketing",23,2
Projektmanager Marketing,mycareernow,0,10396953401,Projektmanager im Social Media Marketing mit Scrum PSM I,24,2
Projektmanager Marketing,mycareernow,0,10396847679,Projektmanager im Organischen Marketing mit Scrum PSM I und PAL,25,2
Prompt Enginnering,Distart Education GmbH,0,10385705728,E-Marketing und Prompt Engineering,1,1
Prompt Enginnering,OneCareer,0,10398152641,Prozessoptimierung und Prompt-Engineering (m/w/d),2,1
Prompt Enginnering,A-Leecon GmbH,0,10393653193,KI-Marketingstrategie und Prompt Engineering,3,1
Prompt Enginnering,Habmann AufstiegsAkademie,0,10371567873,Prozessoptimierung und Prompt-Engineering (m/w/d),4,1
Prompt Enginnering,Bildungswerk der Hessischen Wirtschaft e. V.,0,10371382028,KI-Masterclass Prompt-Designing im Marketing,5,1
Prompt Enginnering,NordWest Training UG (haftungsbeschränkt),0,10351119508,KI-Masterclass Prompt-Designing im Marketing,6,1
Prompt Enginnering,Distart Education GmbH,0,10309969849,Performance Marketing und Prompt Engineering,7,1
Prompt Enginnering,BIB Augsburg GmbH,0,10371365678,KI-Masterclass Prompt-Designing im Marketing,8,1
Prompt Enginnering,Masters of Digital GmbH,0,10387738124,Online Marketing: Prompt Engineering,9,1
Prompt Enginnering,Berger Bildungsinstitut GmbH,0,10365131109,KI-Masterclass Prompt-Designing im Marketing,10,1
Prompt Enginnering,IBB Institut für Berufliche Bildung AG,0,10393532090,KI-Masterclass Prompt-Designing im Marketing,11,1
Prompt Enginnering,New Horizons Nord / West,0,10396072302,Künstliche Intelligenz - KI /AI + Prompt Engineer,12,1
Prompt Enginnering,Berufliche Fortbildungszentren der Bayerischen Wirtschaft (bfz) gGmbH,0,10397084723,KI-Masterclass Prompt-Designing im Marketing,13,1
Prompt Enginnering,Fortbildungsakademie der Wirtschaft (FAW) gGmbH,0,10387750993,KI-Masterclass Prompt-Designing im Marketing,14,1
Prompt Enginnering,Donner + Partner GmbH Baden-Württemberg,0,10371523470,KI-Masterclass Prompt-Designing im Marketing,15,1
Prompt Enginnering,Stiftung Lernen-Fördern-Arbeiten (LFA),0,10379721913,KI-Masterclass Prompt-Designing im Marketing,16,1
Prompt Enginnering,NH Schulungscenter für IT und Business GmbH,0,10396040742,Künstliche Intelligenz - KI /AI + Prompt Engineer,17,1
Prompt Enginnering,Habmann AufstiegsAkademie,0,99101186,Change Management und Prompt-Engineering (m/w/d),18,1
Prompt Enginnering,OneCareer,0,10398152891,Finanzbuchhaltung mit Zusatzqualifikation in Prompt Engineering und Prozessoptimierung,19,1
Prompt Enginnering,Karriere Tutor GmbH,0,10379465289,KI & Prompt Engineering,20,1
Prompt Enginnering,New Horizons Köln - NH Schulungscenter für IT und Business GmbH,0,10395924751,Künstliche Intelligenz - KI /AI + Prompt Engineer,21,2
Prompt Enginnering,OneCareer,0,10398152576,KI-Management und Prompt Engineering für Lösungsdesign,22,2
Prompt Enginnering,New Horizons Hamburg / Bremen,0,10397083152,Künstliche Intelligenz - KI /AI + Prompt Engineer,23,2
Prompt Enginnering,Lecturio GmbH,0,10398928613,KI-Masterclass Prompt-Designing im Marketing,24,2
Prompt Enginnering,mycareernow,0,10396913210,Einkaufsmanager/in mit KI-Kompetenz und Prompt Engineering,25,2
Prompt Kurs,New Horizons München - IT Computer und BusinessTraining Trainings,0,10389239588,Intelligenz Kurs für Generative KI &amp; Prompt Engineering,1,1
Prompt Kurs,New Horizons München - IT Computer und BusinessTraining Trainings,0,10389237799,KI Prompt Engineering Kurs mit Prompting Grundlagen und Advanced Praxis,2,1
Prompt Kurs,Bildung First GmbH,0,10341469059,PSPO 1: Product Owner Kurs mit KI-Grundlagen und Prompt Engineering,3,1
Prompt Kurs,Bildung First GmbH,0,10341468669,"Scrum Master PSM 1 Vorbereitung Kurs mit Kanban Training & KI Grundlagen (Schulung, Prompt Engineering Kurs)",4,1
Prompt Kurs,Bildung First GmbH,0,10342970557,"Scrum Master PSM 1+2 & mit Kanban - Zertifizierung, Frontend Entwickler HTML CSS SASS & KI Grundlagen, Prompt Engineering Kurs",5,1
Prompt Kurs,Bildung First GmbH,0,10341469366,Product Owner Weiterbildung PSPO 2 Kurs / Scrum Kanban (PSK 1) & KI Grundlagen / Prompt Engineering Kurs,6,1
Prompt Kurs,New Horizons München - IT Computer und BusinessTraining Trainings,0,10389237361,KI Kurs für Einsteiger - Grundlagen &amp; Praxis,7,1
Prompt Kurs,New Horizons München - IT Computer und BusinessTraining Trainings,0,10389237939,AI Prompting Kurs mit Prompting Fundamentals und Context Engineering Praxis,8,1
Prompt Kurs,Smart Future Campus GmbH,0,10360561015,AI-Prompting-Kurs und KI-Eingaben,9,1
Prompt Kurs,Bildung First GmbH,0,10341469258,"Scrum: Skaliertes, Kanban & Python Kurs, JavaScript Kurs agil, Master Weiterbildung, Product Owner Kurs",10,1
Prompt Kurs,New Horizons München - IT Computer und BusinessTraining Trainings,0,10389236342,KI Kurs für Unternehmen - Praxisprojekte &amp; Business Value,11,1
Prompt Kurs,StackFuel GmbH,0,10365011789,ChatGPT: Data Scientist Kurs - Schwerpunkt AI,12,1
Prompt Kurs,New Horizons München - IT Computer und BusinessTraining Trainings,0,10372982139,Python + KI Kurse,13,1
Prompt Kurs,New Horizons München - IT Computer und BusinessTraining Trainings,0,10389239881,KI Kurs für Unternehmen - Praxisprojekte &amp; Business Value - Teil 1,14,1
Prompt Kurs,Bildung First GmbH,0,10341468785,"Weiterbildung: Scrum Master Kurs & Product Owner Kurs PSM 2 PSPO 1 / Agile Leadership, Kanban, Python Kurs & JavaScript",15,1
Prompt Kurs,Bildung First GmbH,0,10342972275,"Scrum Master PSM 2: Kurs für Webentwicklung (HTML, CSS, JavaScript) und KI-Grundlagen",16,1
Prompt Kurs,neuefische GmbH,0,10365903842,AI Engineer Kurs für Anfängers,17,1
Prompt Kurs,Bildung First GmbH,0,10341468991,"Product Owner PSPO 1 & Scaled Scrum Training mit JavaScript und KI Kurs, Zertifizierung",18,1
Prompt Kurs,Bildung First GmbH,0,10341469178,"Scrum Product Owner (PSPO 1) & Kanban Python Kurs, KI Grundlagen, Webprogrammierung HTML CSS, JavaScript & Frontend Kurs",19,1
Prompt Kurs,New Horizons München - IT Computer und BusinessTraining Trainings,0,10389238570,Künstliche Intelligenz Kurs für Einsteiger mit AI Foundation und Prompting Praxis,20,1
Prompt Kurs,New Horizons München - IT Computer und BusinessTraining Trainings,0,10389239918,Künstliche Intelligenz Kurs für Business mit AI Foundation und Prompting Praxis,21,2
Prompt Kurs,Bildung First GmbH,0,10342971260,"PSM 2 & PSPO 1+2 Scrum Master & Product Owner Kurs / HTML, CSS, SASS Frontend & KI Grundlagen",22,2
Prompt Kurs,Bildung First GmbH,0,10341469362,"Productowner Praxis: PSPO2, JavaScript & KI Kurs für wirkungsorientierte Produktentwicklung",23,2
Prompt Kurs,New Horizons München - IT Computer und BusinessTraining Trainings,0,10389240904,Künstliche Intelligenz Kurs für Daten mit AI Data und Prompting Praxis,24,2
Prompt Kurs,Bildung First GmbH,0,10342968155,"Scrum Master & Product Owner Kurs (PSM 1 Zertifikat, PSPO 2 Kurs) - Agile Leadership, Python Kurs & Webprogrammierung / Webentwicklung, Frontend",25,2
SEA,Talentspring Academy Group,0,10393437882,SEA,1,1
SEA,WBS TRAINING SE,0,10392928015,SEO und SEA Strategie,2,1
SEA,Akademie Überlingen,0,10398417348,SEO und SEA Grundlagen,3,1
SEA,mycareernow,0,10396850101,SEO und SEA Marketing,4,1
SEA,Karriere Tutor GmbH,0,10393217122,SEO und SEA Marketing,5,1
SEA,Masters of Digital GmbH,0,10389782018,SEO / SEA / SEM,6,1
SEA,OneCareer,0,10388684452,Agiles SEO- und SEA-Marketing,7,1
SEA,OneCareer,0,10377336511,SEO und SEA Strategie,8,1
SEA,Karriere Tutor GmbH,0,10398459794,Prompt Engineering für SEA-Manager:in,9,1
SEA,OneCareer,0,10377336750,SEO und SEA Marketing,10,1
SEA,mycareernow,0,10396862623,SEO und SEA Marketing für Quereinsteiger,11,1
SEA,mycareernow,0,10396857398,SEA für Quereinsteiger,12,1
SEA,IU Akademie IU Internationale Hochschule,0,10343821836,Search Engine Advertising - SEA Basics,13,1
SEA,Masters of Digital GmbH,0,10389766721,Marketing mit KI und SEA,14,1
SEA,DCI Digital Career Institute GmbH,0,10366055964,Digital Marketing Specialist - SEA-Grundlagen,15,1
SEA,neuefische GmbH,0,10365904424,SEO SEA Strategie in der Marketing (mit AI),16,1
SEA,DCI Digital Career Institute GmbH,0,10365637936,SEA-Grundlagen - Quereinstieg,17,1
SEA,Learnix GmbH,0,10390905609,SEO & SEA Spezialist,18,1
SEA,IU Akademie IU Internationale Hochschule,0,10371639795,Suchmaschinenmarketing Expertise (SEO & SEA),19,1
SEA,cimdata Bildungsakademie GmbH,0,10355432590,SEA Manager:in advanced,20,1
SEA,mycareernow,0,10396890097,"KI-gestütztes digitales Vertriebsmanagement mit SEO, SEA und Online-Marketing",21,2
SEA,OneCareer,0,10377318705,Google Ads und Grundlagen SEA im Online Marketing,22,2
SEA,mycareernow,0,10396890360,"Vertriebsassistenz mit KI-Kompetenz: SEO, SEA und digitale Kundenakquise",23,2
SEA,cimdata Bildungsakademie GmbH,0,10355433104,SEA Manager:in kompakt,24,2
SEA,OneCareer,0,10388689082,Scrum Product Owner im SEO und SEA Marketing,25,2
Search Engine Marketing,OneCareer,0,10377336443,Search Engine Marketing,1,1
Search Engine Marketing,Learning Digital Academy GmbH,0,10392015184,Data Driven Search Engine Marketing,2,1
Search Engine Marketing,OneCareer,0,10377337571,Suchmaschinenwerbung: Search Engine Marketing und Content,3,1
Search Engine Marketing,Karriere Tutor GmbH,0,10395764078,Search Engine Marketing und GEO,4,1
Search Engine Marketing,OneCareer,0,10377336436,SEA: Search Engine Advertising,5,1
Search Engine Marketing,OneCareer,0,10377334620,Performance Marketing: Search Engine Advertising und SEM,6,1
Search Engine Marketing,Spiced Academy GmbH,0,10345495172,Web Analytics Tools for Search Engine Marketing,7,1
Search Engine Marketing,Distart Education GmbH,0,10355425763,Search Engine Marketing,8,1
Search Engine Marketing,neuefische GmbH,0,10365893796,Search Engine and Content Optimization,9,1
Search Engine Marketing,neuefische GmbH,0,10365899471,Search Engine Marketing & Web Analytics,10,1
Search Engine Marketing,OneCareer,0,10397480349,Search Engine Optimization für digitale Geschäftsmodelle,11,1
Search Engine Marketing,Professionals Online Akademie für Sales und Marketing,0,10296798040,Search Engine Marketing,12,1
Search Engine Marketing,IU Akademie IU Internationale Hochschule,0,10343822500,Search Engine Optimization - SEO Basics,13,1
Search Engine Marketing,IU Akademie IU Internationale Hochschule,0,10343821836,Search Engine Advertising - SEA Basics,14,1
Search Engine Marketing,Professionals Online Akademie für Sales und Marketing,0,10296797710,Search Engine Advertising (SEA),15,1
Search Engine Marketing,Talentivo GmbH,0,10385190924,"Digitales Marketing, Management und KI: Search Engine Advertising & Meta",16,1
Search Engine Marketing,Nest Academy GmbH,0,10400350371,Weiterbildung in der Suchmaschinenoptimierung: Online und Search Engine Marketing,17,1
Search Engine Marketing,Karriere Tutor GmbH,0,10379472765,SEO (Search Engine Optimization),18,1
Search Engine Marketing,GFN GmbH,0,10397776756,"Multimedia Projektleiter im Tag Management, Web Analytics, Search Engine Optimization (SEO) und Online Marketing inkl Devops",19,1
Search Engine Marketing,CROAS Education GmbH,0,10365482799,Search Engine Optimization Consultant,20,1
Search Engine Marketing,CROAS Education GmbH,0,10365482804,Search Engine Optimization für digitale Geschäftsmodelle,21,2
Search Engine Marketing,CROAS Education GmbH,0,10365481744,Expertenwissen in Search Engine Optimization,22,2
Search Engine Marketing,CROAS Education GmbH,0,10365482825,Search Engine Optimization Konzepte für digitale Plattformstrategien,23,2
Search Engine Marketing,CROAS Education GmbH,0,10365482820,Search Engine Optimization Konzepte für anwenderfreundliche digitale Umgebungen,24,2
Search Engine Marketing,CROAS Education GmbH,0,10365482809,Search Engine Optimization für Experten im digitalen Handel,25,2
SEO,Talentspring Academy Group,0,10393436952,SEO,1,1
SEO,GFN GmbH,0,10395001028,SEO,2,1
SEO,Masters of Digital GmbH,0,10384430801,SEO mit Branding,3,1
SEO,cimdata Bildungsakademie GmbH,0,10126782959,"HTML, SEO, WordPress",4,1
SEO,Nest Academy GmbH,0,10398372437,SEO mit Branding,5,1
SEO,Mentify Learn GmbH,0,10383147428,SEO,6,1
SEO,OneCareer,0,10388684410,Internetmarketing: SEO und digitale Strategien,7,1
SEO,OneCareer,0,10388684797,Marketingoptimierung durch SEO-Strategien,8,1
SEO,Masters of Digital GmbH,0,10384430986,"HTML, SEO, Wordpress",9,1
SEO,OneCareer,0,10388684870,Suchmaschinenmarketing für SEO-Redaktion,10,1
SEO,OneCareer,0,10377337823,Webdesign und SEO Optimierung,11,1
SEO,Nest Academy GmbH,0,10400349964,SEO mit Data,12,1
SEO,Learning Digital Academy GmbH,0,10392062132,Content und SEM/SEO mit Google,13,1
SEO,Learning Digital Academy GmbH,0,10392138207,Google Advertising und SEO im Marketing,14,1
SEO,OneCareer,0,10388685065,Agiles SEO für Quereinsteiger,15,1
SEO,DAA - Deutsche Angestellten- Akademie gGmbH,0,10379209853,SEM und SEO Suchmaschinenmarketing und -optimierung,16,1
SEO,Masters of Digital GmbH,0,10384431364,SEO mit Data,17,1
SEO,TERTIA Berufsförderung GmbH & Co. KG,0,10351124214,SEM und SEO - Suchmaschinenmarketing und Suchmaschinenoptimierung,18,1
SEO,IBB Institut für Berufliche Bildung AG,0,10399629093,SEM und SEO - Suchmaschinenmarketing und Suchmaschinenoptimierung,19,1
SEO,OneCareer,0,10377340062,Google und SEM/SEO mit Data,20,1
SEO,Learning Digital Academy GmbH,0,10329836017,Content Marketing mit SEO und Branding,21,2
SEO,Berger Bildungsinstitut GmbH,0,10380679430,SEM und SEO - Suchmaschinenmarketing und Suchmaschinenoptimierung,22,2
SEO,Lernstudio Barbarossa/MegaKids Fortbildungs GmbH,0,10369526550,SEM und SEO - Suchmaschinenmarketing und Suchmaschinenoptimierung,23,2
SEO,Learning Digital Academy GmbH,0,10392560672,Scrum Projektmanager SEO Marketing,24,2
SEO,OneCareer,0,10388682465,Kampagnenmanager Suchmaschinenmarketing SEO/SEA,25,2
SEO Manager KI,SMD Performance Media,0,10372722266,SEO Manager KI,1,1
SEO Manager KI,mycareernow,0,10396981871,"Social Media Marketing Manager/in mit KI, SEO und SEA",2,1
SEO Manager KI,mycareernow,0,10397009127,"Digital Marketing Manager: KI, Social Media, SEO und SEA gezielt einsetzen",3,1
SEO Manager KI,mycareernow,0,10397003642,"Digital Marketing Manager mit KI, SEO, SEA und Social Media sowie Grundlagen in Finanzierung",4,1
SEO Manager KI,mycareernow,0,10397011957,"Digital Marketing Manager:in mit KI - SEO, SEA, Social Media & Kampagnenmanagement",5,1
SEO Manager KI,mycareernow,0,10396997590,"Online Marketing Manager - SEO, SEA, Social Media & KI-gestütztes Kampagnenmanagement",6,1
SEO Manager KI,mycareernow,0,10396988787,"Online Marketing Manager: SEO, Google Ads & KI-gestützte Kampagnenoptimierung",7,1
SEO Manager KI,mycareernow,0,10396967004,"Social Media Marketing Manager/in mit Kenntnissen in SEO, SEA und KI-gestützter Kommunikation",8,1
SEO Manager KI,mycareernow,0,10396997220,"Online Marketing Manager/in - SEO, SEA, Social Media & KI im E-Commerce",9,1
SEO Manager KI,mycareernow,0,10397015619,"Digital Marketing Manager: SEO, SEA, Social Media und KI-gestützte Marketingprozesse",10,1
SEO Manager KI,mycareernow,0,10397002041,"Online Marketing Manager - SEO, SEA, Social Media & KI-gestütztes Performance Marketing",11,1
SEO Manager KI,mycareernow,0,10397012558,"Projektmanager und Digital Marketing Manager mit SEO, SEA, Social Media und KI-Tools",12,1
SEO Manager KI,mycareernow,0,10396870397,Projektmanagement mit SEO-Grundlagen für den E-Commerce inkl. Datenschutz und KI-Tools,13,1
SEO Manager KI,mycareernow,0,10396906122,"Online-Marketing Manager/in - Social Media, SEO & SEA mit Zertifikat in Prompt Engineering und KI-Anwendungen",14,1
SEO Manager KI,A-Leecon GmbH,0,10393683190,"KI-Automatisierung-Workshop: Cornerstone-Content, SEO-Briefings und Whitepaper-Outlines für Content-Manager-Profile",15,1
SEO Manager KI,mycareernow,0,10396868019,"Projektmanagement mit Cloud Computing, SEO und SEA sowie KI-gestützten IT-Tools",16,1
SEO Manager KI,mycareernow,0,10396991277,"Online Marketing Manager mit Scrum PSM I & II, SEO, SEA, Social Media und KI-Praxis",17,1
SEO Manager KI,GrandEdu GmbH,0,10379367349,SEO Manger mit KI,18,1
SEO Manager KI,CBW College Berufliche Weiterbildung GmbH,0,10388550275,"Marketing Automation mit KI: Performance Marketing, SEA, SEO, Web Analytics und Social Media",19,1
SEO Manager KI,mycareernow,0,10396853880,"Digitales Marketing: Strategische Prozesse in SEO, SEA, Social Media und KI-gestützter Kommunikation",20,1
SEO Manager KI,neuefische GmbH,0,10365893138,E-Commerce and SEO Konzepte für Marketing Manager,21,2
SEO Manager KI,mycareernow,0,10397000009,"Online Marketing Manager: SEO, SEA und digitale Werbekampagnen gezielt steuern",22,2
SEO Manager KI,mycareernow,0,10396847953,"Digitales Marketing: Kreative Prozesse in SEO, SEA, Social Media und KI-gestützter Kommunikation",23,2
SEO Manager KI,Spiced Academy GmbH,0,10345494796,E-Commerce and SEO Wesentliches für Marketing Manager,24,2
SEO Manager KI,cimdata Bildungsakademie GmbH,0,10225575030,"Social Media, CMS & SEO mit Grundlagen KI",25,2
Social Ads im E-Commerce,Learning Digital Academy GmbH,0,10329833838,Google Ads mit Social Media und E-Commerce,1,1
Social Ads im E-Commerce,Learning Digital Academy GmbH,0,10392035563,Ads im Social Commerce,2,1
Social Ads im E-Commerce,SMD Performance Media,0,10379401607,Social Media Ads im E-Commerce KI,3,1
Social Ads im E-Commerce,SMD Performance Media,0,10379404005,Social Media Ads im E-Commerce mit Intensivkurs KI,4,1
Social Ads im E-Commerce,OneCareer,0,10397480728,Meta Ads Basics E Commerce,5,1
Social Ads im E-Commerce,CROAS Education GmbH,0,10365481781,Meta Ads Basics E Commerce,6,1
Social Ads im E-Commerce,OneCareer,0,10397480776,Meta Ads Expertise für professionelle E Commerce Bereiche,7,1
Social Ads im E-Commerce,CROAS Education GmbH,0,10365482733,Meta Ads Expertise für professionelle E Commerce Bereiche,8,1
Social Ads im E-Commerce,CROAS Education GmbH,0,10365481763,Fortgeschrittene Meta Ads Strategien,9,1
Social Ads im E-Commerce,CROAS Education GmbH,0,10365482743,Meta Ads für Shop Betreiber,10,1
Social Ads im E-Commerce,CROAS Education GmbH,0,10365482717,Meta Ads Campaign Manager,11,1
Social Ads im E-Commerce,CROAS Education GmbH,0,10365482774,Meta Ads Strategien,12,1
Social Ads im E-Commerce,CROAS Education GmbH,0,10365482688,Expertenwissen in Meta Ads für digitale Plattformen,13,1
Social Ads im E-Commerce,CROAS Education GmbH,0,10365482728,Meta Ads Expertise für digitale Unternehmen,14,1
Social Ads im E-Commerce,CROAS Education GmbH,0,10365482496,Basics der Meta Ads Nutzung für digitale Unternehmen,15,1
Social Ads im E-Commerce,CROAS Education GmbH,0,10365482720,Meta Ads Entwicklung für moderne digitale Werbestrukturen,16,1
Social Ads im E-Commerce,CROAS Education GmbH,0,10365481773,Meta Ads Advanced Skalierung,17,1
Social Ads im E-Commerce,CROAS Education GmbH,0,10365482736,Meta Ads für B2B Modelle,18,1
Social Ads im E-Commerce,CROAS Education GmbH,0,10365482771,Meta Ads Performance Manager,19,1
Social Ads im E-Commerce,CROAS Education GmbH,0,10365482759,Meta Ads Kampagnen für Produktlaunches,20,1
Social Ads im E-Commerce,CROAS Education GmbH,0,10365481785,Meta Ads Basics Leadgenerierung,21,2
Social Ads im E-Commerce,SMD Performance Media,0,10379403133,Suchmaschinenmarketing- und Social-Ads-Spezialist,22,2
Social Ads im E-Commerce,CROAS Education GmbH,0,10365481758,Fortgeschrittene Meta Ads Methoden,23,2
Social Ads im E-Commerce,CROAS Education GmbH,0,10365482703,Grundlagen der Meta Ads Nutzung im digitalen Umfeld,24,2
Social Ads im E-Commerce,Karriere Tutor GmbH,0,10396157770,Kundenbindung über Social Media für E-Commerce-Spezialist:in,25,2
Social Ads Manager,COMCAVE.COLLEGE GmbH,0,10382341325,Social Network und Ads Manager,1,1
Social Ads Manager,Bildung Next Level GmbH,0,10344971004,Google Ads und Paid Social Manager mit KI,2,1
Social Ads Manager,GrandEdu GmbH,0,10379364319,Google Advertising für SEM Manager: Ads Strategien,3,1
Social Ads Manager,GrandEdu GmbH,0,10379365715,Display Ads-Optimierung für SEM Manager: Strategien im Online Advertising,4,1
Social Ads Manager,SMD Performance Media,0,10379403133,Suchmaschinenmarketing- und Social-Ads-Spezialist,5,1
Social Ads Manager,GrandEdu GmbH,0,10379364786,Google Ads-Techniken für Performance Manager: SEM-Optimierung und ROI-Steigerung,6,1
Social Ads Manager,GrandEdu GmbH,0,10379365578,Digital Advertising für SEM Manager: Strategische Ansätze für Ads,7,1
Social Ads Manager,OneCareer,0,10377318715,Google Ads und Social Media für effektive Marketingkampagnen,8,1
Social Ads Manager,Distart Education GmbH,0,10318997607,Paid Social Management mit Schwerpunkt LinkedIn Ads,9,1
Social Ads Manager,Distart Education GmbH,0,10318997511,Paid Social Management mit Schwerpunkt Meta Ads,10,1
Social Ads Manager,Mentify Learn GmbH,0,10383147431,Meta Ads,11,1
Social Ads Manager,SMD Performance Media,0,10379401607,Social Media Ads im E-Commerce KI,12,1
Social Ads Manager,Technische Hochschule Köln,0,20101000126358,(Online Marketing) Online Kampagnen Manager:in [SEA & Social Ads],13,1
